{
  "activeRoute": "create-symbol",
  "completionCriteria": [
    "Use AGENTS.md and the compiled route packet before editing.",
    "Edit only the authoritative files allowed by the active route.",
    "Run prepare, check, authority-local repair, and close.",
    "Leave zero blocking diagnostics, zero scope violations, and deterministic render evidence."
  ],
  "entryRoute": "create-symbol",
  "expectedArtifacts": [
    "library/electronics/authoring/repaired-resistor.aixsym.json",
    "project.aixproj.json"
  ],
  "facts": {
    "diagnostic": "AIXEM-DIAG-SYMBOL-LEAD-PORT-MISMATCH",
    "symbol": "library/electronics/authoring/repaired-resistor.aixsym.json"
  },
  "formatVersion": "1.0",
  "id": "L008",
  "operation": "repair",
  "project": "project.aixproj.json",
  "prompt": "Repair the symbol lead endpoint so the visible lead and electrical port coincide. Modify only symbol authority and required digest locks.",
  "routingMode": "fixed",
  "schema": "https://schemas.aixem.org/agent/task/1",
  "title": "Broken lead and port",
  "writeConstraints": {
    "prohibitedPaths": [
      "render/**",
      "evidence/**"
    ],
    "requiredValidators": [
      "agent.live_stage",
      "agent.evaluation_invariants"
    ],
    "writableAuthorities": [
      "symbol",
      "component-library",
      "project"
    ],
    "writablePaths": [
      "library/electronics/authoring/repaired-resistor.aixsym.json",
      "library/electronics/authoring/authoring-components.aixlib.json",
      "project.aixproj.json"
    ]
  }
}

