{
  "activeRoute": "compose-project",
  "completionCriteria": [
    "Use AGENTS.md and the compiled route packet before editing.",
    "Edit only the authoritative files allowed by the active route.",
    "Run prepare, check, authority-local repair, and close.",
    "Leave zero blocking diagnostics, zero scope violations, and deterministic render evidence."
  ],
  "entryRoute": "compose-project",
  "expectedArtifacts": [
    "project.aixproj.json"
  ],
  "facts": {
    "projectNets": {
      "command_live_56": [
        "power@OUT",
        "control@IN"
      ],
      "rail_live_56": [
        "power@VCC",
        "control@VCC"
      ],
      "return_live_56": [
        "power@GND",
        "control@GND"
      ]
    }
  },
  "formatVersion": "1.0",
  "id": "L006",
  "operation": "modify",
  "project": "project.aixproj.json",
  "prompt": "Create the three missing explicit project nets for the existing power and control leaf sheets. Use the supplied interface memberships; never connect by equal names or geometry.",
  "routingMode": "fixed",
  "schema": "https://schemas.aixem.org/agent/task/1",
  "title": "Two-sheet hierarchical composition",
  "writeConstraints": {
    "prohibitedPaths": [
      "render/**",
      "evidence/**"
    ],
    "requiredValidators": [
      "agent.live_stage",
      "agent.evaluation_invariants"
    ],
    "writableAuthorities": [
      "project"
    ],
    "writablePaths": [
      "project.aixproj.json"
    ]
  }
}
