{
  "activeRoute": "route-nets",
  "completionCriteria": [
    "Use AGENTS.md and the compiled route packet before editing.",
    "Edit only the authoritative files allowed by the active route.",
    "Run prepare, check, authority-local repair, and close.",
    "Leave zero blocking diagnostics, zero scope violations, and deterministic render evidence."
  ],
  "entryRoute": "route-nets",
  "expectedArtifacts": [
    "multi_terminal_junction.aixlayout.json",
    "project.aixproj.json"
  ],
  "facts": {
    "crossingNet": "cross",
    "junction": [
      75,
      50
    ],
    "members": [
      "T1.1",
      "T2.1",
      "T3.1"
    ],
    "net": "fabric_l005"
  },
  "formatVersion": "1.0",
  "id": "L005",
  "operation": "modify",
  "project": "project.aixproj.json",
  "prompt": "Complete the missing branch for semantic net fabric_l005 with an explicit junction. Preserve the separate crossing net and do not infer connectivity from geometry.",
  "routingMode": "fixed",
  "schema": "https://schemas.aixem.org/agent/task/1",
  "title": "Three-terminal semantic net",
  "writeConstraints": {
    "prohibitedPaths": [
      "render/**",
      "evidence/**"
    ],
    "requiredValidators": [
      "agent.live_stage",
      "agent.evaluation_invariants"
    ],
    "writableAuthorities": [
      "layout",
      "project"
    ],
    "writablePaths": [
      "multi_terminal_junction.aixlayout.json",
      "project.aixproj.json"
    ]
  }
}
